<?xml version="1.0" encoding="UTF-8"?>
<!DOCTYPE ConseguenzeSegnalazioni SYSTEM "../XML/DTD/conseguenzeSegnalazioniDTD.dtd">
<ConseguenzeSegnalazioni><ConseguenzaSegnalazioni><codiceSegnalazione>1</codiceSegnalazione><testoWarning>ale&#13;
ale&#13;
ale</testoWarning><versoChi>account2</versoChi><descrizioneConseguenza>2</descrizioneConseguenza><dataEvasioneSegnalazione>2024-12-04</dataEvasioneSegnalazione><utenteGestore>admin</utenteGestore></ConseguenzaSegnalazioni></ConseguenzeSegnalazioni>
